{
  "$schema": "http://json-schema.org/draft-07/schema#",
  "$id": "https://skillpkg.dev/schemas/skillpkg.json",
  "title": "skillpkg.json",
  "description": "Project configuration for skillpkg - AI Workflow Manager",
  "type": "object",
  "required": ["name"],
  "properties": {
    "$schema": {
      "type": "string",
      "description": "JSON Schema reference for IDE support"
    },
    "name": {
      "type": "string",
      "description": "Project name",
      "pattern": "^[a-z0-9][a-z0-9-]*[a-z0-9]$|^[a-z0-9]$"
    },
    "version": {
      "type": "string",
      "description": "Project version (semver)",
      "pattern": "^\\d+\\.\\d+\\.\\d+(-[a-zA-Z0-9.-]+)?(\\+[a-zA-Z0-9.-]+)?$"
    },
    "skills": {
      "type": "object",
      "description": "Skills to install (name -> source)",
      "additionalProperties": {
        "type": "string",
        "description": "Skill source (github:user/repo, URL, or local path)"
      }
    },
    "mcp": {
      "type": "object",
      "description": "MCP server configurations",
      "additionalProperties": {
        "$ref": "#/definitions/McpConfig"
      }
    },
    "reminders": {
      "type": "array",
      "description": "Project-level reminders for AI agents",
      "items": {
        "type": "string"
      }
    },
    "hooks": {
      "type": "object",
      "description": "Lifecycle hooks (event -> script path)",
      "properties": {
        "pre-install": { "type": "string" },
        "post-install": { "type": "string" },
        "pre-sync": { "type": "string" },
        "post-sync": { "type": "string" }
      },
      "additionalProperties": {
        "type": "string"
      }
    },
    "sync_targets": {
      "type": "object",
      "description": "Sync targets (target name -> enabled)",
      "properties": {
        "claude-code": { "type": "boolean", "default": true },
        "cursor": { "type": "boolean", "default": false },
        "codex": { "type": "boolean", "default": false },
        "copilot": { "type": "boolean", "default": false },
        "windsurf": { "type": "boolean", "default": false }
      },
      "additionalProperties": false
    }
  },
  "definitions": {
    "McpConfig": {
      "type": "object",
      "required": ["package"],
      "properties": {
        "package": {
          "type": "string",
          "description": "npm package name"
        },
        "command": {
          "type": "string",
          "description": "Executable command name"
        },
        "args": {
          "type": "array",
          "description": "Command arguments",
          "items": { "type": "string" }
        },
        "required": {
          "type": "boolean",
          "description": "Whether this MCP is required for the project",
          "default": false
        },
        "env": {
          "type": "object",
          "description": "Environment variables",
          "additionalProperties": { "type": "string" }
        }
      }
    }
  },
  "additionalProperties": false
}
